;autor;contenido;derecho;fecha;fechaPublicacion;idPeriodico;imagen;palabrasClaves;periodico;seccion;subtitular;titular;url
0;El Nacional;['Mariano de Alba, abogado especialista en derecho internacional, aseguró este jueves que hace falta un quiebre entre las alianzas de poder de los militares y los empleados de la administración pública para lograr un cambio político en el país.', ''Hacia esa dirección está encaminada la estrategia de Juan Guaidó, quien ha dirigido sus esfuerzos a llamar a los militares a ponerse del lado de la Constitución y a desconocer a Nicolás Maduro, y por otro lado el quiebre del poder del Estado, es decir, llamar a los civiles a que reconozcan la Carta Magna', explicó De Alba luego de un conversatorio realizado en la Universidad George Washington.', 'El especialista en asuntos políticos aseguró que las conversaciones entre el presidente interino de Venezuela y el gobierno de Estados Unidos puede tener efectos positivos en una eventual reestructuración de la deuda externa.', ''En teoría, la deuda puede ser de alguna forma 'perdonada', y el dinero que ingrese al país una vez que cese la usurpación puede ser destinado, al principio, para la población más desfavorecida', aseveró.'];3.2;07/03/2019;2019-03-66T04:15:00-0400;273771;http://en-cdnmed.agilecontent.com//resources/jpg/9/6/1550199265069.jpg;Política;EN;Política;El politólogo aseguró que las conversaciones entre el presidente interino de Venezuela, Juan Guaidó, y el gobierno de Estados Unidos pueden ser beneficiosas para una eventual reestructuración de la deuda externa en el caso de una transición política;Mariano de Alba: Hace falta un quiebre de las alianzas del poder;http://www.el-nacional.com/noticias/politica/mariano-alba-hace-falta-quiebre-las-alianzas-del-poder_273771
1;EL NACIONAL;['José Manuel Olivares, diputado a la Asamblea Nacional (AN) en el exilio, recibió un nuevo cargamento de ayuda humanitaria en Cúcuta (Colombia) que será destinado a los venezolanos.', ''La ayuda humanitaria y el compromiso por los venezolanos sigue. Hoy recibimos un avión proveniente de Estados Unidos con ayuda humanitaria de muchos países de Latinoamerica. Entre los medicamentos se encuentran para distintas patólogias, anticoagulante, medicamentos para pacientes cardiovasculares y neurológicos. También fueron enviados unos instrumentos mundiales para atender a más de 10.000 personas en un centro de salud', expresó el parlamento en exclusiva a El Nacional.', 'La ayuda humanitaria en dos containers de 50 toneladas y, al menos, seis camiones llegaron al centro de acopio. Los vehículos llegaron escoltados por funcionarios de la Policía Nacional de Colombia.', 'El envío de este nuevo cargamento se realizó dos semanas luego que Nicolás Maduro impidió el ingreso de más de 200 toneladas de ayuda humanitaria a Venezuela al imponer varios cordones policiales en cada uno de los pasos fronterizos en Venezuela.', 'La Agencia de EE UU para el Desarrollo (USAID) informó que fue enviado un nuevo cargamento de suministros adicionales de ayuda humanitaria que fueron enviados desde Florida. Entre los suministros médicos que transporte el avión de carga militar C-130 se encuentran guantes, batas quirúrgicas, mascarillas y suministros de limpieza.', 'Foto: El Nacional', 'Foto: El Nacional', 'Foto: El Nacional'];2.1;07/03/2019;2019-03-66T04:07:00-0400;273783;;Colombia, Ayuda humanitaria;EN;Sociedad;El envío de este nuevo cargamento se realizó dos semanas luego que Nicolás Maduro impidió el ingreso de más de 200 toneladas de ayuda humanitaria a Venezuela;Olivares ofreció detalles sobre nuevo cargamento de ayuda humanitaria;http://www.el-nacional.com/noticias/sociedad/olivares-ofrecio-detalles-sobre-nuevo-cargamento-ayuda-humanitaria_273783
2;El Nacional;['Jose Ignacio Hernández, procurador designado por el presidente interino de Venezuela, Juan Guaidó, aseguró este jueves que asesorará a la Presidencia interina para proteger, recuperar y controlar los activos de la nación en el extranjero.', 'Hernández aclaró que no le corresponde realizar investigaciones penales en torno a la naturaleza de los activos y determinar hechos delictivos. 'Eso le corresponde al Ministerio Público, pero si nos corresponde recuperar el patrimonio en el exterior, estén o no relacionados con la corrupción', aseveró.', 'El funcionario venezolano reiteró que el único gobierno legítimo que reconoce la administración de Donald Trump es el del también presidente de la Asamblea Nacional, Juan Guaidó.', 'El pasado 20 de febrero la Comisión Permanente de Política Interior del Parlamento autorizó la designación de Hernández.', ''Esta Comisión autorizó la designación de José Ignacio Hernández como procurador especial para la defensa del Estado y de los demás entes descentralizados de la Administración Pública en el exterior, de acuerdo con el artículo 15, literal b, del Estatuto que rige la transición a la democracia', indicó el diputado Dennis Fernández en una carta dirigida a Edinson Ferrer Arteaga, secretario del Poder Legislativo.'];1.2;07/03/2019;2019-03-66T04:01:00-0400;273780;http://en-cdnmed.agilecontent.com//resources/jpg/0/8/1551288991780.jpg;Política, Mundo;EN;Política;El funcionario designado por el presidente interino de Venezuela, Juan Guaidó, explicó que no le corresponde llevar a cabo investigaciones penales de presunta corrupción sobre el patrimonio nacional en el exterior;Jose Ignacio Hernández: Nos corresponde recuperar los activos venezolanos;http://www.el-nacional.com/noticias/politica/jose-ignacio-hernandez-nos-corresponde-recuperar-los-activos-venezolanos_273780
3;RAYNER RICO | @RaynerRico29;['Cuando a finales de febrero Jhoulys Chacín se reportó a los Spring Training con los Cerveceros de Milwaukee y compareció frente a los medios de comunicación en su primera entrevista de pretemporada, una de las oraciones que más repitió fue la de que no se consideraba como un as dentro del pitcheo.', 'Las declaraciones del venezolano sirvieron como respuesta a las diversas interrogantes sobre cuáles eran sus sensaciones acerca de llegar a los campos de entrenamiento con la responsabilidad de encabezar una rotación de abridores en la campaña 2019, considerando que terminó como el lanzador más efectivo de la tropa lupulosa la contienda anterior.', 'Sin ánimos de notarse como un arrogante y con la única intención de conservar el ambiente de unión que se percibe en el clubhouse de Milwaukee, Chacín priorizó lo que es el trabajo colectivo, por encima de lo individual.', '“Simplemente soy una pieza más de un grupo dispuesto a hacer su trabajo. Todos los peloteros que formamos parte de este club tratamos de ayudarnos, esa es la esencia de un equipo, ya que aquí no reinan los intereses de cada uno, sino los de todos”, le manifestó el experimentado lanzador en ese momento al periodista Tom Haudricourt, corresponsal del Journal Sentinel.', 'Aunque en su enfoque no se distingue como el líder del staff de pitcheo espumoso, todo indica que en eso se ha convertido y cada actuación que tiene en la primavera lo certifica.', 'Chacín cuenta con solo dos actuaciones en los juegos de exhibición de la MLB, pero las mismas han sido suficientes para afianzarse como el gran candidato a realizar los envíos iniciales en el Opening Day.', 'En su primera salida, el viernes contra los Indios de Cleveland, trabajó solo un episodio y retiró a los tres bateadores que enfrentó con tan solo cinco pitcheos. Mientras que el miércoles en otro encuentro de la Liga del Cactus frente a los Cascabeles de Arizona, lanzó tres entradas completas, en las que recibió una carrera limpia y un par de imparables, sin boletos y un ponche.', 'En ambas presentaciones lo más importante no ha sido el dominio sobre el contrario, sino la localización de los envíos y el movimiento de sus pitcheos secundarios como lo son el cambio y el sinker, o al menos así lo hizo saber Craig Counsell, manager de los Cerveceros, como parte de sus impresiones sobre el venezolano.', 'Para  Chacín gran parte del éxito obtenido en esta etapa de su carrera se lo adjudica a la tranquilidad que consiguió en Milwaukee, conjunto que le brindó toda la confianza necesaria como para trabajar sin ningún tipo de presiones y además le ofrece altas posibilidades de actuar en postemporadas, algo que no había podido hacer en sus años anteriores.', '“Estoy realmente contento por la confianza brindada y espero volver a responder a ella a lo largo de este certamen”, sentenció.', 'Se espera que Chacín realice por lo menos dos aperturas más en la pretemporada antes de hacer su estreno oficial en la ronda regular que apunta para ser el 28 de marzo contra los Cardenales de San Luis en el Miller Park.'];2.1;07/03/2019;2019-03-66T04:00:00-0400;273787;http://en-cdnmed.agilecontent.com//resources/jpg/6/6/1551987025566.jpg;MLB, Beisbol, Grandes Ligas, Deportes;EN;Beisbol;Dos aperturas en la pretemporada han sido suficientes para que el venezolano haya demostrado por qué lo consideran el as de Milwaukee;Jhoulys Chacín se consolida como el líder de la rotación cervecera;http://www.el-nacional.com/noticias/beisbol/jhoulys-chacin-consolida-como-lider-rotacion-cervecera_273787
4;Rosibel Cristina González | rcgonzalez@el-nacional.com;['Por homicidio calificado y uso indebido del arma de reglamento fue detenido Douglas Alfredo Volcán Arellano, primer teniente de la Guardia Nacional Bolivariana y enfermero en el Hospital Militar del Ejercito Doctor Vicente Salias Sanoja, ubicado en la zona castrense de El Valle.', 'El viernes 1º de marzo en la noche, Volcán llegó a la tasca El Madrid, situada en el sector Puente Hierro, parroquia Santa Rosalía. Testigos afirmaron que una mujer pelirroja lo acompañaba.', 'Luego de tomar varios tragos, salió del local. Minutos después volvió y con su arma de reglamento disparó contra Flor Nazaret Alcalá Gutiérrez,  Gabriel Arturo Calzado Blanco y José Luis Quintero, que estaban en el local. Otras 2 personas de esa misma mesa resultaron heridas.', 'Volcán huyó del lugar. Calzado y Quintero murieron en el sitio, mientras que Alcalá fue llevada a la Clínica Loira en El Paraíso y, a pesar de contar con recursos económicos, no fue atendida y murió en la calle, frente al centro de salud privado. De los dos heridos, se conoció que fueron recluidos en otros hospitales y se encuentran fuera de peligro.', 'Detectives asignados al caso se dirigieron al local nocturno y solicitaron los recibos de pago por consumos realizados por el teniente prófugo y responsable del triple homicidio. Con los datos recabados a través de su tarjeta de débito, los detectives del organismo judicial se dirigieron al hospital donde prestaba servicios de enfermero en la emergencia del turno de la noche y lo aprehendieron. Se conoció que era médico integral comunitario.', 'Hasta el mes de noviembre del año pasado el teniente vivía en la urbanización Raúl Villanueva, en El Silencio, con una pareja. Luego se mudó a la avenida Victoria, donde fue acompañado por los detectives para ubicar elementos de interés criminalístico.', 'Flor Nazaret Alcalá Gutiérrez era madre de un bebé y pertenecía a la Orquesta Sinfónica desde los tres años de edad. Es a la fecha, la mujer número 20 y la primera del mes de marzo, asesinada en la Gran Caracas, de acuerdo con información extraoficial.'];1.1;07/03/2019;2019-03-66T03:50:00-0400;273778;http://en-cdnmed.agilecontent.com//resources/jpg/6/7/1551986454576.jpg;GNB, Sucesos;EN;Sucesos;Lo aprehendieron en un hospital de El Valle donde trabajaba como enfermero, aunque era médico integral comunitario;Detuvieron a primer teniente de la GNB acusado de triple homicidio;http://www.el-nacional.com/noticias/sucesos/detuvieron-primer-teniente-gnb-acusado-triple-homicidio_273778
5;EFE;['Allen Chastenet, primer ministro de Santa Lucía, exigió elecciones justas para poner fin a la crisis que atraviesa Venezuela, en consonancia con la postura de los países de la Comunidad del Caribe (Caricom).', 'Chastenet, en una declaración institucional, pidió a Nicolás Maduro que realice hacia unas elecciones justas, solicitud reiterada en varias ocasiones por la comunidad internacional.', ''Santa Lucía ha observado, sin embargo, que el régimen de Nicolás Maduro ha ignorado esta petición que cuenta con el apoyo de la mayoría de los países del mundo. Nuestro país continuará trabajando con todos los países y organizaciones interesados en asegurar la democracia en Venezuela y garantizar la estabilidad regional', sostuvo Chastanet.', 'Chastenet destacó que ya sea por referéndum, elecciones o cualquier otro mecanismo acordado, esa es la vía que conducirá a concluir la crisis en el país.', 'Adelantó que el gobierno de Santa Lucía seguirá de cerca la crisis venezolana, y destacó además que la seguridad de las fronteras de Santa Lucía es un asunto prioritario para su gobierno, en especial desde el incremento del tráfico de armas y drogas con origen en Venezuela.'];2.1;07/03/2019;2019-03-66T03:43:00-0400;273774;http://en-cdnmed.agilecontent.com//resources/jpg/8/7/1551986094378.jpg;Mundo, Latinoamérica;EN;Latinoamérica;El primer ministro del país caribeño aseguró que espera que la crisis en el país se solucione y que incrementará la seguridad en sus fronteras debido al incremento de tráfico de drogas y armas con origen en el territorio venezolano;Santa Lucía pidió elecciones para terminar con la crisis de Venezuela;http://www.el-nacional.com/noticias/latinoamerica/santa-lucia-pidio-elecciones-para-terminar-con-crisis-venezuela_273774
6;Diario El Universal;['Caracas.-Petróleos de Venezuela (Pdvsa) no ha interrumpido sus negocios con la firma marítima Bernhard Schulte Shipmanagement (BSM), dijo este jueves la compañía petrolera,', '.', 'El brazo marítimo de Pdvsa, PDV Marina, el pasado martes declaró una emergencia debido a la falta de tripulación para recibir de inmediato los 10 buques que BSM propuso devolver debido a facturas impagas por al menos 15 millones de dólares.  La mayoría de los petroleros se encuentran en aguas venezolanas. Otros tres buques operados por BSM para Pdvsa permanecen anclados en Portugal y Curazao hasta que se resuelvan las disputas legales relacionadas con las tarifas que Pdvsa debe a las agencias marítimas, las autoridades portuarias y los astilleros. 'PDV Marina es una filial de Pdvsa que continúa trabajando con la empresa BSM (...) PDV Marina ofrece el transporte marítimo y fluvial de hidrocarburos, además de la prestación del servicio de remolcadores alcanzando jornadas diarias satisfactorias”, dijo la petrolera en la red social Twitter. Pdvsa no dio detalles sobre sus planes para operar los buques devueltos, según información de Reuters. Portavoces de BSM, no respondieron a solicitudes de comentarios.    La firma alemana opera una flota de 15 buques de Pdvsa, incluidos 8 Aframaxes que se usan principalmente para mover petróleo entre los puertos nacionales de Venezuela y el Caribe, cuatro Suezmaxes que anteriormente servían a destinos de exportación, pero recientemente también navegaban en aguas venezolanas, el Aframax Arita que cubre rutas a Asia, y dos portadores de crudo muy grandes propiedad conjunta de Pdvsa y PetroChina.La tripulación de la empresa alemana abandonó el mes pasado dos embarcaciones ancladas en Portugal -“Río Arauca” y “Parnaso”-, después de mantener al personal a bordo durante más de 20 meses. La firma ha dicho que la responsabilidad legal de los buques recae en las partes.    Más de una docena de petroleros con crudo venezolano ha sido detenida por las autoridades en el mundo en los últimos años o se le ha impedido navegar porque Pdvsa no ha podido pagar la operación, la limpieza del casco, las inspecciones y otros servicios. El Gobierno de Nicolás Maduro ha sido severamente sancionado desde fines de enero, porque Estados Unidos y docenas de otras naciones han reconocido al líder de la Asamblea Nacional (AN), el opositor Juan Guaidó, como presidente encargado de Venezuela.'];2.1;07/03/2019;07/03/2019 03:31 pm;35038;http://mmedia.eluniversal.com/17925/pdvsa-16483.jpg;NO_TIENE;EU;economia;Las empresas continúan sus negocios pese a la decisión de la firma alemana de devolver 10 de los 15 buques por no pagar tarifas;Pdvsa dice que seguirá trabajando con la firma marítima alemana BSM;http://www.eluniversal.com/economia/35038/pdvsa-sigue-trabajando-con-la-firma-maritima-alemana-bsm
7;ANA CAROLINA ARIAS;['Nueva Esparta.- La plataforma Unidos por la Salud de la isla Margarita avanza en el objetivo para el cual se unieron, como es organizar las necesidades en el estado ante una 'inminente' entrada de ayuda humanitaria, y en ese sentido trabajan en la fase 1 como lo ha establecido la Asamblea Nacional.', 'Germán Rojas Loyola, miembro de la plataforma y vocero de la Sociedad de Puericultura y Pediatría de Nueva Esparta, informó que los gremios médicos y organismos con trabajo en salud que conforman este grupo, determinan en campo los casos de desnutrición y personas con enfermedades crónicas, que en efecto serán la prioridad a atender con las acciones especiales que ha dispuesto el Parlamento.', 'Dijo que los niños desnutridos de cero a cinco años, las mujeres embarazadas, los adolescentes y personas de tercera edad en igual condición y además, en estado de abandono o dependencia, serán los atendidos en una primera fase porque son vidas en absoluto riesgo.', 'Destacó la 'ayuda urgente' que requieren las personas con padecimientos crónicos como hipertensión, diabetes, en tratamiento de diálisis y oncología, así como con detección positiva de Virus de Inmuno deficiencia Humano (VIH), ya que la situación de emergencia compleja médico asistencial eleva la vulnerabilidad de su salud.', 'Rojas informó que a la fecha Nueva Esparta no ha recibido ayuda foránea, y la crisis se sigue sobrellevando solo con el programa médico asistencial de la Gobernación de Nueva Esparta.', 'No obstante, lamentó que la red hospitalaria y ambulatoria de Nueva Esparta mantenga 'serias deficiencias' en su plan de alimentación para las personas hospitalizadas, por cuanto acelera el deterioro de los cientos de pacientes recluidos en estos espacios.', 'Plan de insumos', 'Efectivamente, en los últimos días el gobernador de la entidad, Alfredo Díaz, ha agilizado el programa de dotación de insumos médicos, registrando ya la cuarta 'Cruzada de la Salud' que lleva por municipio.', 'La planificación es atender 50 ambulatorios de Margarita y Coche, además de las entregas que ya se han hecho en el Hospital Luis Ortega de Porlamar, y centros de salud de los municipios Mariño y García.', 'Recalcó que el programa que ejecuta busca suplir las faltas en las que incurre el Gobierno nacional a través del Ministerio de Salud y demás instituciones del sector, con lo cual espera al menos ayudar a los más necesitados, pues afirma que es doloroso que los bonos que entrega el Gobierno además de ser excluyentes tienen que ser dispuestos por las familias para este tipo de urgencias porque no hay políticas que garanticen el derecho a la salud.'];2.1;07/03/2019;07/03/2019 01:51 pm;35010;http://mmedia.eluniversal.com/17962/gremios-de-la-salud-siguen-planificacion-por-fase-ayuda-humanitaria-para-nueva-esparta-19266.jpg;NO_TIENE;EU;venezuela;Casos de desnutrición en niños, adolescentes y ancianos, así como personas con enfermedades crónicas son prioridad;Gremios de la salud siguen planificación por fase de ayuda humanitaria para Nueva Esparta;http://www.eluniversal.com/venezuela/35010/gremios-de-la-salud-siguen-planificacion-por-fase-ayuda-humanitaria-para-nueva-esparta
8;LUIGI RAMIREZ;['En horas de la noche de ayer seis de marzo un grupo de antisociales asesinaron al comisario jefe del Cuerpo de Investigaciones Científicas Penales y Criminalísticas (Cicpc),  del estado Miranda, Fernando Antonio Jiménez, en la carretera Nacional La Raiza, entrada al Manguito de Los  Valles del Tuy.', 'Según fuentes policiales, el hecho ocurrió cuando se encontraba en el operativo de retorno de Carnaval 2019 en esa región.', 'De acuerdo a la versión del portal web Agencia Carabobeña de Noticias (ACN), al comisario general lo emboscaron varios delincuentes, quienes integran la banda delictiva del “Vizcaino”, que opera en dicha zona. Se conoció que en este hecho también resultó herido el detective José Díaz, de quien se desconoce su estado de salud. Por su parte, el Comisario General Douglas Rico, director  del Cicpc expresó sus palabras de condolencia a familiares y amigos ante el hecho,  a través de su redes sociales @douglasricovzla.  “Mis palabras no les quitará el dolor y sufrimiento a familiares, amigos y compañeros de trabajo del C/G Fernando Jiménez.”  Pero les aseguro que no descansaremos hasta dar con quienes le quitaron la vida. No a la impunidad.”'];1.1;07/03/2019;07/03/2019 01:45 pm;35011;http://mmedia.eluniversal.com/17962/comisario-jimenez-cicpc-19269.jpg;NO_TIENE;EU;sucesos;El funcionario fue identificado como Fernando Jiménez , quien fue asesinado por antisociales cuando se encontraba en medio del operativo de Carnaval en la carretera La Raiza.;Matan a un comisario del Cicpc en el estado Miranda;http://www.eluniversal.com/sucesos/35011/fallece-comisario-del-cicpc-tras-un-enfrentamiento-en-miranda
9;AVN;['Caracas.-El sistema del Tipo de Cambio Complementario Flotante del Mercado (Dicom) cotizó la tasa del euro en 3.734,04 bolívares, informó este jueves el Banco Central de Venezuela (BCV).', 'En cuanto a otras tasas referenciales, la moneda china, el yuan, se ubicó en 461,65 bolívares, el rublo ruso se ubicó en 50,04 bolívares, y la lira turca en 608,48 bolívares.', 'El Dicom cuenta con 625.035 usuarios registrados en su página web www.dicom.gob.ve, 41.918 personas jurídicas y 583.117 personas naturales.', 'La cotización del euro la jornada anterior del día miércoles 6 de marzo, se ubicó en 3.760,58 bolívares, una ligera baja en comparación con la tasa de este jueves (Bs. 3.734,04).'];2.1;07/03/2019;07/03/2019 11:59 am;34994;http://static.eluniversal.com/2018/04/20/euros.jpg;NO_TIENE;EU;economia;"La moneda china, el yuan, se ubicó en 461,65 bolívares; el rublo ruso se ubicó en 50,04 bolívares; y la lira turca en 608,48 bolívares";Euro Dicom se ubicó en 3.734,04 bolívares este jueves;http://www.eluniversal.com/economia/34994/euro-dicom-se-ubico-en-373404-bolivares-este-jueves
10;Diario El Universal;['Dos funcionarios de Policía de Chacao (Polichacao), uno activo y otro retirado, fueron asesinados ayer en horas  de la tarde presuntamente en manos de oficiales de las Fuerzas de Acciones Especiales (Faes) de la Policía Nacional en un hecho registrado en Guarenas la denuncia la confirmó el alcalde de Chacao, Gustavo Duque a través de su cuenta en twitter.', 'Según el informe policial de las Faes, Alexander Eligio Duarte y Fernando Lira fueron ultimados durante un 'enfrentamiento armado para la liberación de un cautivo'.', 'Sin embargo, el alcalde de Chacao exigió que se investigue este hecho.'];1.1;07/03/2019;07/03/2019 08:43 am;34977;http://mmedia.eluniversal.com/17962/polichacao-19235.jpg;NO_TIENE;EU;sucesos;El alcalde Gustavo Duque exigió justicia ante este hecho.Las víctimas fueron Alexander Eligio Duarte (Polichacao activo) y Fernando Lira, exfuncionario de este organismo policial.;Denuncian que efectivos de las Faes asesinaron a dos polichacao;http://www.eluniversal.com/sucesos/34977/denuncian-que-agentes-de-las-faes-asesinaron-a-dos-polichacao
