;autor;contenido;derecho;fecha;fechaPublicacion;idPeriodico;imagen;palabrasClaves;periodico;seccion;subtitular;titular;url
20;Diario El Universal;"['Caracas.-xa0 El Ministerio de Turismo, convoca a inversionistas nacionales e internacionales, a participar en una rueda de negocios a realizarse los días 28 y 29 de marzo en Caracas, a través de la cual se divulgarán los distintos espacios turísticos del país y sus variados proyectos de expansión.', 'La titular del despacho, Stella Lugo informó que la industria del “turismo mueve el 10% del Producto Interno Bruto (PIB) mundial” y es interés del Gobierno absorber capitales locales y externos  que acompañen el crecimiento del turismo nacional.', 'La funcionaria resaltó que el motor turismo trabaja de la mano con el sector privado a través de la firma de convenios y alianzas estratégicas para el acondicionamiento de  infraestructuras turísticas en la amplia, diversa y atractiva geografía nacional.', '“Vamos a ofrecer a Venezuela con el ambiente turístico que la caracteriza; las áreas priorizadas para la inversión son Isla La Tortuga, Los Roques (Territorio Insular Francisco de Miranda), estado Anzoátegui y parque Canaima, estado Bolívar, Los Roques, Margarita, Parque Nacional Mochima, entre otros”, apunto la Ministra, según AVN.', 'Asimismo Lugo recordó que en la XIII Feria Internacional de Turismo de Venezuela (FitVen), efectuada en noviembre de 2018 en el parque Bolívar, ubicado en la Base Aérea La Carlota, se planteó convocar a esta rueda de negocios, luego de las firmas de cartas de intención de inversión por parte de  delegaciones internacionales.', '“Hemos venido trabajando en esas cartas de intención y hay una primera proyección para atraer la inversión internacional en nuestros espacios turísticos; los iraníes quieren invertir en nuestras islas y, realmente hay muchísima iniciativa por parte de representantes internacionales”, dijo.', 'Destacó también que como parte de la Marca País que impulsa el Ejecutivo asociado a la actividad turística “podemos romper el cerco mediático, mostrar la Venezuela profunda y atraer gente que conozca la esencia del país”. E indicó que “el disfrute de los venezolanos no lo van a decir  medios internacionales, que están empeñados en derrotar al pueblo venezolano”.']";3.2;07/03/2019;07/03/2019 05:30 am;34910;http://mmedia.eluniversal.com/17961/playas-19183.jpg;NO_TIENE;EU;economia;Mintur realizará rueda de negocios los días 28 y 29 de marzo;Invitan a capitales a invertir en sector turismo nacional;http://www.eluniversal.com/economia/34910/invitan-a-capitales-a-invertir-en-sector-turismo-nacional
21;Diario El Universal;['Caracas.-xa0La entidad rusa RFC Bank se encargará en lo adelante de las cuentas de Pdvsa.  La decisión de transferir  los recursos de la petrolera y otras empresas nacionales a  la “Corporación financiera rusa” (RFC Bank)  fue tomada por las autoridades de ese país después de las consultas con la parte venezolana y las empresas involucradas con dichas transacciones.', 'De acuerdo a lo informado por la agencia de noticias Sputnik, una de las fuentes vinculadas con dichos cambios afirmó que “el RFC Bank se convertirá en un banco básico para atender a todas las compañías venezolanas, se trata en particular de Pdvsa”.', 'Según refiere el reporte, fuentes citadas por Reuters afirmaron que la petrolera estatal venezolana solicitó a los representantes ejecutivos de sus empresas mixtas que abonen los ingresos en dólares o euros por las ventas del petróleo a nuevas cuentas en el banco ruso Gazprombank (GPB), abiertas supuestamente para eludir las sanciones de EEUU.', 'Pero Gazprombank negó haber abierto nuevas cuentas para Pdvsa y especificó  que la información de Reuters “no corresponde con la realidad”.', '“Siendo una de las mayores petroleras del mundo, Pdvsa tiene cuentas abiertas en muchos bancos importantes, en particular internacionales. También se abrieron las cuentas de Petróleos de Venezuela en el grupo GPB hace unos años, en el marco de la cooperación que el banco mantiene con varias empresas rusas que son sus clientes. Sin embargo, subrayamos que el banco no abrió ni planea abrir cuentas nuevas”, aclaró el ente en un comunicado.', 'Este miércoles, el asesor de Seguridad Nacional de la Casa Blanca, John Bolton, advirtió a los bancos extranjeros y otras instituciones financieras que enfrentarán sanciones de EEUU por transacciones “ilegítimas” que beneficien al presidente Nicolás Maduro y su red.', '“Enfrentarán sanciones por participar en la facilitación de transacciones ilegítimas que beneficien a Nicolás Maduro y su red corrupta”, afirmó Bolton a través de una nota de prensa.'];2.3;07/03/2019;07/03/2019 05:30 am;34970;http://mmedia.eluniversal.com/17961/trabajadores-petroleros-descartan-privatizar-pdvsa-19196.jpg;NO_TIENE;EU;economia;La institución se encuentra entre las sancionadas por Estados Unidos;Anuncian el cambio de cuentas de Pdvsa a entidad RFC Bank;http://www.eluniversal.com/economia/34970/anuncian-el-cambio-de-cuentas-de-pdvsa-a-entidad-rfc-bank
22;LEOPOLDO PUCHI;['•tEl senador Marco Rubio afirmó ayer que “Venezuela está a sólo unos días de la más severa escasez de alimentos y combustibles que la nación jamás haya enfrentado”.', '•t“La situación de Venezuela ha sido agravada por las sanciones”, señaló Michel Bachelet durante su intervención en el 40° período de sesiones del Consejo de Derechos Humanos de la ONU al hacer una breve referencia a la situación de cada país.', '•tY, de acuerdo con Torino Capital, las nuevas sanciones “acarrean el riesgo de empeorar más las cosas”, dado el embargo petrolero y el bloqueo de las cuentas bancarias de Venezuela en el exterior.', '•tJohn Bolton dijo el día que incluso las entidades extranjeras que permitan transacciones del gobierno venezolano enfrentarían sanciones.', '•tComo se sabe, en el flujograma de cambio de gobierno en curso, las sanciones van dirigidas generar escasez, ya que se considera que así se provoca malestar social, lo que a su vez presionaría a los militares a una sublevación.', '•tCody Weddle, periodista de nacionalidad estadounidense, fue detenido durante varias horas por la dirección de inteligencia militar y posteriormente deportado.', '•tEl embajador alemán Daniel Kriener fue declarado persona no grata por el gobierno venezolano, que ha estimado que Kriener ejercía un rol “propio de un dirigente político”.', '•tStalin González, vicepresidente de la Asamblea Nacional, considera que un proceso electoral solo puede realizarse luego de que Nicolás Maduro sea depuesto. “Esta es la razón por la que hablamos de un Gobierno de transición”.', '•tEn la misma dirección, Luis Almagro indicó que no sería viable una mediación “entre oposición y oficialismo, porque Nicolás Maduro no es legítimo”.', '•tPor su parte, Elliot Abrams sostuvo que “en toda transición en Latinoamérica hay negociaciones”.'];2.1;07/03/2019;07/03/2019 05:30 am;34975;http://imgs.globovision.com/QhbSMqzm4e3kP4RRFk7RRZfoxVo=/847x0/smart/2ec26868a92549ae86f1136935449b9f;NO_TIENE;EU;politica;Elliot Abrams sostuvo que “en toda transición en Latinoamérica hay negociaciones”.;Las sanciones dirigidas a provocar  escasez de combustible y alimentos;http://www.eluniversal.com/politica/34975/las-sanciones-dirigidas-a-provocar-escasez-de-combustible-y-alimentos
23;AFP;['Los combatientes kurdos y árabes de las Fuerzas Democráticas Sirias (FDS) habían reanudado el viernes su ofensiva en la localidad de Baghuz, pero tuvieron que interrumpirla ya que miles de mujeres y niños, así como numerosos heridos abandonaron el sector los últimos días. Los últimos yihadistas están allí acorralados, destacó AFP.', 'Tras el atardecer en Baghuz, las FDS bajaron de un camión a numerosas mujeres heridas, en sus posiciones.', 'Muchas de ellas tuvieron que ser transportadas en camilla, en tanto médicos de la ONG estadounidense Free Burma Rangers atendían a las recién llegadas, envolviendo en una manta a una mujer cuya condición requería una atención inmediata.', 'Oleadas no finalizan', 'Detrás de ellas, una solemne procesión de hombres barbudos, custodiados por milicianos armados, avanzaba lentamente hacia las tropas de la coalición y los combatientes de las FDS, que intentan identificar a posibles yihadistas.', 'Las mujeres, de negro y con los ojos en lágrimas, se acercaban para observarlas y preguntaron a las FDS adónde iban a llevarlos.', 'Entre los evacuados había varios niños, entre ellos siete yazidíes, minoría que sufrió en particular los abusos de EI.', ''Cada vez que creemos que se trata de la última oleada, hay nuevas salidas' del reducto yihadista, dijo un responsable de las FDS bajo condición del anonimato.', 'Desde el techo de un edificio en Baghuz, en donde están desplegados combatientes de las FDS, se veía el miércoles una columna de humo en el sector controlado por los yihadistas, que alcanza sólo a unas casas linderas a un campamento improvisado.', 'Los aviones de la coalición internacional están permanentemente sobrevolando el sector, pero se abstienen de atacar.', 'Entre las posiciones de las FDS y el campamento se ven una decena de carcasas de coches carbonizadas. En el campamento se ve hombres corriendo entre las carpas.', 'Los que salieron el martes de Baghuz, en su mayoría venidos de Francia, Bélgica o Finlandia, aseguran que aún habría varias miles de personas en el bastión yihadista.', ''Traumatismo'En los llanos cerca de Baghuz, un océano de mujeres en niqab negro formaban fila el martes para ser registradas.Luego de ser registradas, muchas de ellas se instalan en el piso con sus bebes, en medio de botellas de agua, pan y pañales que les fueron distribuidos.También hay hombres, recostados sobre camillas o en equilibrio con muletas.'Aun hay mucha gente', dice una belga de 24 años, que creció en Francia y que se presenta como Safia.Su marido, un francés, sigue en el sector de los yihadistas. Sólo quiere 'descansar y pensar' dice la mujer que salió 'de un traumatismo'.En 2014 los yihadistas del grupo Estado Islámico lanzaron una ofensiva relámpago que les permitió autoproclamar en junio de ese año un 'califato' en Siria e Irak.Miles de extranjeros, entre ellos europeos, se unieron al grupo yihadista que desde hace dos años pierde terreno por las múltiples ofensivas.Más de 57.000 personas, principalmente familiares de yihadistas, dejaron el último bastión desde principios de diciembre, según el Observatorio Sirio de Derechos Humanos (OSDH). Entre ellas, más de 6.000 yihadistas fueron detenidos, según esta fuente.'Necesidades urgentes'Los civiles evacuados, entre ellos las esposas e hijos de los yihadistas, son trasladados hacia campamentos de desplazados en el noreste sirio. Principalmente el de Al Hol, en donde decenas de miles de personas viven en condiciones difíciles, denunciadas por las ONG.'La necesidad más urgente sigue siendo un techo', pero también asistencia médica, 'física y psicológica', 'en particular para los grupos vulnerables, como las mujeres embarazadas, los niños y los ancianos', subrayaba el lunes la Oficina de la ONU para la Coordinación de Asuntos Humanitarios (OCHA) en Siria.'El seguimiento de numerosos casos de niños no acompañados y separados (de sus familias) sigue siendo una prioridad', agregaba la agencia.Si ISIS pierde su último bastión en Baghuz sería el fin del 'califato'.Pero el grupo ya comenzó a transformarse en organización clandestina. Aún hay combatientes dispersos en el vasto desierto del centro sirio.La batalla contra ISIS es hoy el principal frente de la guerra en Siria que dejó desde 2011 más de 360.000 muertos.'];2.1;07/03/2019;07/03/2019 05:30 am;34908;http://mmedia.eluniversal.com/17961/fuerzas-democraticas-sirias-en-las-cercanias-de-baghuz-siria-19191.jpg;NO_TIENE;EU;internacional;Los combatientes árabo-kurdos de las Fuerzas Democráticas Sirias habían reanudado el viernes su ofensiva en la localidad de Baghuz, pero tuvieron que interrumpirla ya que miles de mujeres y niños;Los habitantes del último reducto de ISIS en Siria siguen saliendo;http://www.eluniversal.com/internacional/34908/los-habitantes-del-ultimo-reducto-de-isis-en-siria-siguen-saliendo
24;AFP;"['Ciudad de México.- El gobierno de Andrés Manuel López Obrador admitió el miércoles que México ha fallado a la hora de proteger a las mujeres y presentó un plan para prevenir y sancionar la violencia de género que en 2018 se tradujo en 3.580 mujeres o niñas asesinadas.', '“A todas ellas las une un factor común: la falta de intervención oportuna y diligente del Estado mexicano para preservar su integridad y para asegurar sus vidas”, reconoció la secretaria de Gobernación, Olga Sánchez Cordero, quien agregó que en los últimos años tanto la violencia común como la violencia de la delincuencia organizada se han ensañado con las mujeres, señaló AFP.', 'Entre las medidas del plan están identificar y corregir los vacíos y problemas estructurales de las investigaciones sobre feminicidios, violencia sexual, familiar y desapariciones; homologar los delitos contra las mujeres en los distintos estados; fortalecer la coordinación entre fiscalías, servicios de salud y autoridades para que se atienda a las mujeres “con sensibilidad y calidad” y buscar a las mujeres desde el primer aviso de desaparición, explicó Nadine Gasman, presidenta del Instituto Nacional de las Mujeres (Inmujeres), durante una conferencia de prensa junto al presidente y la secretaria de Gobernación.', 'Homologar el delito de feminicidio, que todavía no está tipificado en 13 estados, y cuantificarlo es una de las asignaturas pendientes de México, según han denunciado en varias ocasiones diversos colectivos de mujeres que se quejan de que sólo un buen diagnóstico podrá conllevar medidas eficaces contra este tipo de violencia.', 'Además el acceso a la justicia sigue pendiente en muchos casos, por ejemplo, de la fronteriza Ciudad Juárez, la localidad que en la década de los 90 se hizo tristemente famosa por los asesinatos y desapariciones de mujeres.', 'El Observatorio Ciudadano Nacional del Feminicidio, que agrupa a distintas organizaciones y trabaja con datos oficiales, registró más de 1.500 asesinatos de mujeres cada año desde 2014, pero menos de un tercio fueron investigados como feminicidios. Además, alertó que se trata de datos parciales ya que no todos los estados proporcionaron información. En 2017, por ejemplo, registró 1.583 en solo 18 estados.', 'El gobierno no especificó cuántos de los 3.580 asesinatos fueron considerados feminicidios.', 'Gasman, que consideró a la violencia contra las mujeres un “problema de Estado”, anunció también la creación de un registro nacional de transportes públicos (que es donde se han dado muchos casos de desapariciones de mujeres y niñas); la elaboración de un patrón de víctimas indirectas para poder atenderlas (hijos menores, por ejemplo); la detección de casos de violencia en menores a través de trabajo en las escuelas, y la puesta en marcha de aplicaciones en celulares o cualquier otro instrumento que prevenga nuevos ataques, sobre todo en las zonas de mayor incidencia.', 'La directora de Inmujeres reconoció que 17 estados, más de la mitad, tienen activada una alerta de género, un mecanismo que obliga a las autoridades a poner en marcha medidas adicionales ante una emergencia. Sin embargo, reconoció que esa herramienta debe mejorarse. Asimismo, se comprometió a rendir cuentas periódicamente sobre la puesta en marcha de todo el plan.', 'Precisamente este último punto es considerado clave para las organizaciones. Según la presidenta del Observatorio, María de la Luz Estrada, en ninguno de esos 17 estados las autoridades han evaluado si se cumplieron o no las recomendaciones. “No se están entregando resultados y la impunidad sigue creciendo”, dijo Estrada.', 'En concreto mencionó el caso del Estado de México, la región que rodea la capital, el más poblado del país y el primero que ha sido sentenciado por los tribunales por errores y carencias en este tema.', '“No hay voluntad política, la autoridad sigue sin actuar”, lamentó y puso el ejemplo de uno de sus municipios, Ecatepec, donde no se han puesto cámaras en el río de los Remedios, un canal donde se han encontrado decenas de cuerpos desmembrados de mujeres desde hace años.', 'A su juicio, el gobierno federal tiene la oportunidad ahora de demostrar que quiere mejorar la situación, debe involucrarse con los estados en la desarticulación de las redes criminales que matan o desaparecen a mujeres y tiene que contar con las organizaciones civiles que tienen experiencia en el tema para definir cómo pondrá en marcha las medidas anunciadas “para que no se sigan repitiendo esquemas que no sirven”.', 'Sobre los refugios para las mujeres víctimas de la violencia, un tema que ha sido objeto de polémica en los últimos días, Sánchez Cordero enfatizó que seguirán funcionando pero que el gobierno actuará como rector de los mismos ya que sólo 20 de los 70 tienen parámetros de excelencia.', 'Declaraciones cruzadas de miembros del gobierno sugirieron que se cortaría la financiación de estos refugios y que serían las mujeres quienes recibirían ayudas puntuales en caso de ser víctimas de violencia. Sin embargo, lo que habrá será un mayor control y el dinero se destinará a los refugios a través de los estados y los municipios, aclaró la secretaria de Gobernación.', '“Lo que queremos es que el Estado se ocupe de la protección a las mujeres”, subrayó López Obrador sobre los refugios.']";2.1;07/03/2019;07/03/2019 05:30 am;34938;http://mmedia.eluniversal.com/17746/639.jpg;NO_TIENE;EU;internacional;El gobierno de Andrés Manuel López Obrador admitió que México ha fallado a la hora de proteger a las mujeres y presentó un plan para prevenir y sancionar la violencia de género;México admite falla en atender violencia mujeres y lanza plan de protección;http://www.eluniversal.com/internacional/34938/mexico-admite-falla-en-atender-violencia-mujeres-y-lanza-plan-de-proteccion
25;JOSÉ ANTONIO GIL YEPES;"['Las fuerzas democráticas acaban de ganar un round más en su lucha por la renovación del gobierno: La entrada de Guaidó al país. Esta es la segunda victoria que se presenta bajo un encuadre dilemático en el que no se puede perder. Si el oficialismo detenía al Presidente Interino, perdía y arriesgaba a precipitar su propio desenlace; pero si dejaba libre a Guaidó, también perdía terreno; más aún si fueron tantas las amenazas de que sería detenido.', 'Este mismo encuadre dilemático tuvo lugar con la Ayuda Humanitaria: Si el gobierno la dejaba entrar, perdía y, si no lo hacía, también perdía, porque quedaba como un régimen insensible ante el hambre y la falta de medicinas.', 'Pero ¿por qué el oficialismo dejaría entrar a Guaidó sin detenerlo? Aquí surgen tres hipótesis complementarias. El grupo de Maduro puede haber sacado la cuenta de que la pérdida de dejarlo libre era menor que apresarlo; lo cual luce cierto. Lo cual implicaría que el madurismo puede haberse autoevaluado, concluyendo correctamente, que, al no haber dejado entrar la Ayuda Humanitaria, su gobierno perdió más que habiéndola recibido. Una segunda hipótesis es que el chavismo esté dividido entre los Duros y el Chavismo Democrático, incluyendo ambas facciones a civiles y militares. El Chavismo Democrático puede estar buscando minimizar los daños que le causan al país las políticas extremistas que siguen los Duros, por lo que estarían buscando negociar la entrega del gobierno en las mejores condiciones posibles para evitar el colapso de su movimiento.', 'La tercera hipótesis: Al no apresar a Guaidó, el régimen puede estar, no solo comprando tiempo, si no con una dirección: para atornillarse. Por ejemplo, buscando acelerar inversiones de países que le apoyan para elevar los costos de una intervención. Una muestra: la mudanza de Pdvsa Europa de Portugal a Moscú. Entonces, le corresponde al gobierno de Guaidó decretar, o a la Asamblea Nacional legislar, que toda compra, venta, convenio que haga el grupo en el poder no sería reconocido por el nuevo gobierno. Este pudiera ser uno de los nuevos dilemas que le presenten los demócratas al régimen.', '@joseagilyepes']";2.1;07/03/2019;07/03/2019 05:00 am;34830;http://mmedia.eluniversal.com/17766/jose-antonio-gil-yepes-2879.jpg;NO_TIENE;EU;el-universal;Al no apresar a Guaidó, el régimen puede estar, no sólo comprando tiempo, si no con una dirección: para atornillarse. Por ejemplo, buscando acelerar inversiones de países que le apoyan...;Regresó Guaidó;http://www.eluniversal.com/el-universal/34830/regreso-guaido
